{
  "specversion": "1.0",
  "id": "evt_01J8Z3K4QW5V6X7Y8Z9A0B1C2D",
  "source": "/voice/satellite/wohnzimmer",
  "type": "jarvis.input.utterance",
  "subject": "session/s_7f3a",
  "time": "2026-09-26T19:42:05.120Z",
  "datacontenttype": "application/json",
  "correlationid": "cor_4b9e2d",
  "actor": "user:alex",
  "trust": "household",
  "priority": "normal",
  "data": {
    "text": "Mach das Licht in der Küche auf vierzig Prozent",
    "language": "de",
    "session_id": "s_7f3a",
    "stt_confidence": 0.94,
    "speaker": { "user_id": "alex", "confidence": 0.91 },
    "device_id": "sat_wohnzimmer",
    "area": "wohnzimmer"
  }
}
